{
  "$schema": "https://json-schema.org/draft/2020-12/schema",
  "$id": "https://github.com/JayV-Coder/jayv-coder-mods/schema/mod.schema.json",
  "title": "JayV mod",
  "description": "One mod of JayV: what it is and what it adds to each extension point of the app (contributes). scripts/catalog.mjs is the authority: this schema only helps editors.",
  "type": "object",
  "additionalProperties": false,
  "required": ["id", "version", "category", "plan", "minApp", "title", "summary", "contributes"],
  "properties": {
    "$schema": { "type": "string" },
    "id": { "type": "string", "pattern": "^[a-z][A-Za-z0-9-]{1,39}$", "description": "The folder name. A mod with agents uses lowercase letters, digits and - (up to 28)." },
    "version": { "type": "string", "pattern": "^\\d+\\.\\d+\\.\\d+$", "description": "The version of the mod itself." },
    "category": { "enum": ["start", "chat", "agents", "gate", "privacy", "project", "team", "account", "app"] },
    "plan": { "type": ["string", "null"], "pattern": "^[a-z][A-Za-z]{1,39}$", "description": "The plan feature the mod needs, or null." },
    "minApp": { "type": "string", "pattern": "^\\d+\\.\\d+\\.\\d+$", "description": "The oldest app that runs the mod; at least the version of every extension point it uses." },
    "preinstalled": { "type": "boolean", "description": "Installed, and on, when the person signs in; if they uninstall it, it does not come back." },
    "required": { "type": "boolean", "description": "Essential: JayV needs it. Always installed and on; nobody turns it off or uninstalls it. Implies preinstalled." },
    "requires": { "type": "array", "maxItems": 16, "uniqueItems": true, "items": { "type": "string", "pattern": "^[a-z][A-Za-z0-9-]{1,39}$" }, "description": "Other mods this one needs installed and on." },
    "author": { "type": "string", "minLength": 1, "maxLength": 60 },
    "docs": { "type": "string", "pattern": "^[A-Za-z][A-Za-z0-9]{0,63}$" },
    "homepage": { "type": "string", "pattern": "^https://" },
    "title": { "$ref": "#/$defs/texts" },
    "summary": { "$ref": "#/$defs/texts" },
    "contributes": {
      "type": "object",
      "additionalProperties": false,
      "minProperties": 1,
      "description": "What the mod adds to each extension point of the app.",
      "properties": {
        "llmEngines": { "$ref": "#/$defs/engines", "description": "LLM integration engines of the app it turns on (engines.json › llm)." },
        "features": { "$ref": "#/$defs/engines", "description": "Optional features of the app it turns on (engines.json › feature)." },
        "agents": {
          "type": "array",
          "minItems": 1,
          "maxItems": 4,
          "description": "Command-line or API agents installed as agents of the person (mod-<id>, mod-<id>-2…).",
          "items": { "$ref": "#/$defs/agent" }
        },
        "skills": {
          "type": "array",
          "minItems": 1,
          "maxItems": 4,
          "description": "Skills Jev picks by the request, like the skills people install; the MCP servers of a skill reach the agent only in the request where Jev picks it (app 0.103.0 or newer).",
          "items": { "$ref": "#/$defs/skill" }
        }
      }
    }
  },
  "$defs": {
    "texts": {
      "type": "object",
      "additionalProperties": false,
      "required": ["en", "pt-BR", "es", "zh-CN", "hi", "ar", "fr", "ru", "ja", "de"],
      "properties": {
        "en": { "type": "string", "minLength": 1 },
        "pt-BR": { "type": "string", "minLength": 1 },
        "es": { "type": "string", "minLength": 1 },
        "zh-CN": { "type": "string", "minLength": 1 },
        "hi": { "type": "string", "minLength": 1 },
        "ar": { "type": "string", "minLength": 1 },
        "fr": { "type": "string", "minLength": 1 },
        "ru": { "type": "string", "minLength": 1 },
        "ja": { "type": "string", "minLength": 1 },
        "de": { "type": "string", "minLength": 1 }
      }
    },
    "engines": { "type": "array", "minItems": 1, "uniqueItems": true, "items": { "type": "string", "pattern": "^[a-z][A-Za-z0-9]{1,39}$" } },
    "agent": {
      "oneOf": [
        {
          "type": "object",
          "additionalProperties": false,
          "required": ["kind", "protocol", "baseUrl", "keyRequired"],
          "properties": {
            "kind": { "const": "api" },
            "protocol": { "enum": ["openai", "anthropic"] },
            "baseUrl": { "type": "string", "pattern": "^https?://" },
            "keyRequired": { "type": "boolean" },
            "models": { "$ref": "#/$defs/models" }
          }
        },
        {
          "type": "object",
          "additionalProperties": false,
          "required": ["kind", "command", "args"],
          "properties": {
            "kind": { "const": "cli" },
            "command": { "type": "string", "pattern": "^\\S+$" },
            "args": { "$ref": "#/$defs/line" },
            "planArgs": { "$ref": "#/$defs/line" },
            "edits": { "type": "boolean" },
            "models": { "$ref": "#/$defs/models" }
          }
        }
      ]
    },
    "skill": {
      "type": "object",
      "additionalProperties": false,
      "required": ["name", "description"],
      "oneOf": [{ "required": ["instructions"] }, { "required": ["file"] }],
      "properties": {
        "name": { "type": "string", "pattern": "^[A-Za-z0-9_-]{1,64}$", "description": "The name of the skill in the app." },
        "description": { "type": "string", "minLength": 1, "maxLength": 400, "description": "When to use it, in English: Jev reads this to pick the skill." },
        "instructions": { "type": "string", "minLength": 1, "maxLength": 16000, "description": "What the model does with it, in English. Or use file." },
        "file": { "type": "string", "pattern": "^[A-Za-z0-9][A-Za-z0-9._-]{0,63}\\.md$", "description": "A .md file in the folder of the mod with the instructions; the build puts its text in the catalog." },
        "mcpServers": { "type": "array", "maxItems": 4, "items": { "$ref": "#/$defs/mcpServer" } }
      }
    },
    "mcpServer": {
      "type": "object",
      "additionalProperties": false,
      "required": ["name"],
      "properties": {
        "name": { "type": "string", "pattern": "^[A-Za-z0-9_-]{1,40}$", "not": { "const": "jayv" } },
        "transport": { "enum": ["stdio", "http"], "default": "stdio" },
        "command": { "type": "string", "pattern": "^\\S+$", "description": "stdio: the program, without arguments." },
        "args": { "type": "array", "items": { "type": "string", "minLength": 1 } },
        "env": { "type": "object", "additionalProperties": { "type": "string" } },
        "url": { "type": "string", "pattern": "^https?://", "description": "http: the address of the server." },
        "headers": { "type": "object", "additionalProperties": { "type": "string" } }
      }
    },
    "line": { "type": "array", "maxItems": 64, "items": { "type": "string", "minLength": 1, "maxLength": 1000 } },
    "models": { "type": "array", "maxItems": 50, "uniqueItems": true, "items": { "type": "string", "pattern": "^[A-Za-z0-9._:/@\\[\\]-]{1,120}$" } }
  }
}
