{
  "$schema": "../../schema/mod.schema.json",
  "id": "rea",
  "version": "1.0.0",
  "category": "agents",
  "plan": "skills",
  "minApp": "0.103.0",
  "preinstalled": true,
  "requires": ["skills", "mcp"],
  "author": "JayV",
  "docs": "skills",
  "homepage": "https://rea.tools",
  "title": {
    "en": "REA — reverse engineering",
    "pt-BR": "REA — engenharia reversa",
    "es": "REA — ingeniería inversa",
    "zh-CN": "REA — 逆向工程",
    "hi": "REA — रिवर्स इंजीनियरिंग",
    "ar": "REA — الهندسة العكسية",
    "fr": "REA — rétro-ingénierie",
    "ru": "REA — обратная разработка",
    "ja": "REA — リバースエンジニアリング",
    "de": "REA — Reverse Engineering"
  },
  "summary": {
    "en": "Jev hands the request to REA when it asks how an app, a binary, an .asar, a website or a process works without its source code. The agent gets REA's tools only for that request and answers with the evidence.",
    "pt-BR": "O Jev passa o pedido ao REA quando ele pergunta como funciona um app, um binário, um .asar, um site ou um processo sem o código-fonte. O agente recebe as ferramentas do REA só naquele pedido e responde com as evidências.",
    "es": "Jev pasa la solicitud a REA cuando pregunta cómo funciona una app, un binario, un .asar, un sitio web o un proceso sin su código fuente. El agente recibe las herramientas de REA solo en esa solicitud y responde con las evidencias.",
    "zh-CN": "当请求询问某个应用、二进制文件、.asar、网站或进程在没有源代码时如何工作，Jev 会把请求交给 REA。智能体只在这次请求中获得 REA 的工具，并附上证据作答。",
    "hi": "जब अनुरोध पूछता है कि कोई ऐप, बाइनरी, .asar, वेबसाइट या प्रोसेस अपने सोर्स कोड के बिना कैसे काम करता है, तो Jev उसे REA को सौंपता है। एजेंट को REA के टूल सिर्फ़ उसी अनुरोध के लिए मिलते हैं और वह सबूतों के साथ जवाब देता है।",
    "ar": "يسلّم Jev الطلب إلى REA عندما يسأل عن طريقة عمل تطبيق أو ملف ثنائي أو ملف ‎.asar أو موقع أو عملية دون الشيفرة المصدرية. يحصل الوكيل على أدوات REA في ذلك الطلب فقط ويجيب مع الأدلة.",
    "fr": "Jev confie la demande à REA quand elle porte sur le fonctionnement d'une app, d'un binaire, d'un .asar, d'un site ou d'un processus sans son code source. L'agent reçoit les outils de REA pour cette demande seulement et répond avec les preuves.",
    "ru": "Jev передаёт запрос REA, когда в нём спрашивают, как устроено приложение, бинарный файл, .asar, сайт или процесс без исходного кода. Агент получает инструменты REA только для этого запроса и отвечает с доказательствами.",
    "ja": "アプリ、バイナリ、.asar、Web サイト、プロセスがソースコードなしでどう動くかを尋ねる依頼のとき、Jev はその依頼を REA に任せます。エージェントはその依頼のときだけ REA のツールを受け取り、根拠を示して答えます。",
    "de": "Jev übergibt die Anfrage an REA, wenn sie fragt, wie eine App, eine Binärdatei, eine .asar-Datei, eine Website oder ein Prozess ohne Quellcode funktioniert. Der Agent erhält die Werkzeuge von REA nur für diese Anfrage und antwortet mit den Belegen."
  },
  "contributes": {
    "skills": [
      {
        "name": "reverse-engineering",
        "description": "Reverse engineer existing software without its source code with REA: native executables and libraries (Mach-O, ELF, PE, .app), JavaScript/Electron apps and .asar files, .NET, Android APKs, websites and running processes. Use when the request asks how an app, binary or page works inside, for evidence of its behavior, or to rebuild a feature seen in it.",
        "file": "rea.md",
        "mcpServers": [
          {
            "name": "rea",
            "command": "npx",
            "args": ["-y", "rea-agents@6.4.0", "--mcp"]
          }
        ]
      }
    ]
  }
}
